dev/.documenter/tutorials/burramys_parvus_predictors.csv

geometry,bio1,bio3,bio7,bio12
"(148.391097, -36.30362)",6.1706977,41.119827,23.4645,1692.0
"(148.396453, -36.381847)",6.881583,42.268078,23.133,1544.0
"(147.096394, -36.935687)",9.408354,40.790546,23.0895,1292.0
"(148.332969, -36.433349)",7.8357186,41.597527,23.50275,1500.0
"(148.235596, -36.524924)",8.001604,41.846535,22.85225,1368.0
"(148.347186, -36.504673)",8.420698,43.542496,23.142,1223.0
"(148.328896, -36.431684)",7.8357186,41.597527,23.50275,1500.0
"(151.250866, -33.831883)",17.316963,45.777245,18.43916,1320.0
"(148.240881, -36.400058)",7.8357186,41.597527,23.50275,1500.0
"(147.1, -37.0)",9.408354,40.790546,23.0895,1292.0
"(148.338776, -36.430986)",6.881583,42.268078,23.133,1544.0
"(148.3167, -36.4167)",7.8357186,41.597527,23.50275,1500.0
"(148.4167, -36.35)",6.881583,42.268078,23.133,1544.0
"(148.4833, -36.45)",6.881583,42.268078,23.133,1544.0
"(148.3667, -36.2667)",6.1706977,41.119827,23.4645,1692.0
"(148.3, -36.45)",7.8357186,41.597527,23.50275,1500.0
"(148.3167, -36.4167)",7.8357186,41.597527,23.50275,1500.0
"(151.25, -33.83)",17.316963,45.777245,18.43916,1320.0
"(148.5, -36.6667)",12.083521,46.92699,24.3545,668.0
"(148.25, -36.4167)",7.8357186,41.597527,23.50275,1500.0
"(148.4167, -36.35)",6.881583,42.268078,23.133,1544.0
"(148.3, -36.45)",7.8357186,41.597527,23.50275,1500.0
"(148.3, -36.45)",7.8357186,41.597527,23.50275,1500.0
"(148.5, -36.6667)",12.083521,46.92699,24.3545,668.0
"(148.4167, -36.35)",6.881583,42.268078,23.133,1544.0
"(148.4167, -36.35)",6.881583,42.268078,23.133,1544.0
"(148.333, -35.983)",10.904552,44.098557,25.31125,1202.0
"(147.133, -36.983)",9.408354,40.790546,23.0895,1292.0
"(147.133, -37.0)",9.408354,40.790546,23.0895,1292.0
"(148.416, -36.316)",6.1706977,41.119827,23.4645,1692.0
"(147.133, -36.983)",9.408354,40.790546,23.0895,1292.0
"(148.416, -36.316)",6.1706977,41.119827,23.4645,1692.0
"(148.416, -36.316)",6.1706977,41.119827,23.4645,1692.0
"(148.416, -36.316)",6.1706977,41.119827,23.4645,1692.0
"(148.38499, -36.39805)",6.881583,42.268078,23.133,1544.0
"(150.379713, -33.721678)",13.9018955,46.938244,21.39975,1170.0
"(148.594015, -36.520245)",10.527271,46.933758,25.44375,799.0
"(148.291238, -36.491651)",7.8357186,41.597527,23.50275,1500.0
"(151.43233, -33.276415)",17.47297,47.646797,19.771626,1215.0
"(150.380119, -34.555703)",13.095739,47.539433,22.50075,1126.0
"(148.63323, -36.44334)",9.876781,46.603935,25.618502,864.0
"(147.15, -36.98)",9.408354,40.790546,23.0895,1292.0
"(148.459399, -36.00639)",6.928167,41.78015,23.69975,1647.0
"(148.459399, -36.00639)",6.928167,41.78015,23.69975,1647.0
"(148.451335, -35.999862)",8.269542,41.030262,23.858,1440.0
"(148.451335, -35.999862)",8.269542,41.030262,23.858,1440.0
"(148.459399, -36.00639)",6.928167,41.78015,23.69975,1647.0
"(148.451335, -35.999862)",8.269542,41.030262,23.858,1440.0
"(148.451335, -35.999862)",8.269542,41.030262,23.858,1440.0
"(150.278569, -33.638508)",12.546812,45.695683,22.921751,1114.0
"(148.459399, -36.00639)",6.928167,41.78015,23.69975,1647.0
"(148.3404, -36.412537)",6.881583,42.268078,23.133,1544.0
"(148.459399, -36.00639)",6.928167,41.78015,23.69975,1647.0
"(151.298215, -33.532818)",17.065975,45.266735,18.109188,1255.0
"(151.369495, -33.501434)",17.370098,44.34605,17.270588,1330.0
"(148.29123, -36.49165)",7.8357186,41.597527,23.50275,1500.0
"(150.248911, -33.580339)",12.546812,45.695683,22.921751,1114.0
"(147.15, -36.98)",9.408354,40.790546,23.0895,1292.0
"(147.15, -36.98)",9.408354,40.790546,23.0895,1292.0
"(147.15, -36.98)",9.408354,40.790546,23.0895,1292.0
"(147.15, -36.98)",9.408354,40.790546,23.0895,1292.0
"(147.149, -36.988)",9.408354,40.790546,23.0895,1292.0
"(148.461854, -36.009001)",6.928167,41.78015,23.69975,1647.0
"(148.461854, -36.009001)",6.928167,41.78015,23.69975,1647.0
"(148.451831, -35.998449)",8.269542,41.030262,23.858,1440.0
"(148.461854, -36.009001)",6.928167,41.78015,23.69975,1647.0
"(148.450743, -35.999643)",8.269542,41.030262,23.858,1440.0
"(148.461854, -36.009001)",6.928167,41.78015,23.69975,1647.0
"(148.450743, -35.999643)",8.269542,41.030262,23.858,1440.0
"(148.461854, -36.009001)",6.928167,41.78015,23.69975,1647.0
"(150.379713, -33.721678)",13.9018955,46.938244,21.39975,1170.0
"(148.451335, -35.999862)",8.269542,41.030262,23.858,1440.0
"(148.450743, -35.999643)",8.269542,41.030262,23.858,1440.0
"(148.459399, -36.00639)",6.928167,41.78015,23.69975,1647.0
"(148.451335, -35.999862)",8.269542,41.030262,23.858,1440.0
"(148.451335, -35.999862)",8.269542,41.030262,23.858,1440.0
"(150.390083, -33.705417)",13.9018955,46.938244,21.39975,1170.0
"(148.459399, -36.00639)",6.928167,41.78015,23.69975,1647.0
"(148.39239, -35.951825)",8.269542,41.030262,23.858,1440.0
"(148.392241, -35.951583)",8.269542,41.030262,23.858,1440.0
"(148.39239, -35.951825)",8.269542,41.030262,23.858,1440.0
"(148.39239, -35.951825)",8.269542,41.030262,23.858,1440.0
"(148.392241, -35.951583)",8.269542,41.030262,23.858,1440.0
"(148.467196, -36.000859)",6.928167,41.78015,23.69975,1647.0
"(148.471019, -36.004202)",6.928167,41.78015,23.69975,1647.0
"(148.392241, -35.951583)",8.269542,41.030262,23.858,1440.0
"(148.40889, -36.006805)",6.928167,41.78015,23.69975,1647.0
"(147.1647, -36.95835)",9.408354,40.790546,23.0895,1292.0
"(147.16021, -36.96016)",9.408354,40.790546,23.0895,1292.0
"(147.16021, -36.96016)",9.408354,40.790546,23.0895,1292.0
"(147.16021, -36.96016)",9.408354,40.790546,23.0895,1292.0
"(147.16021, -36.96016)",9.408354,40.790546,23.0895,1292.0
"(147.24294, -36.9068)",6.8537397,39.09556,22.146751,1519.0
"(147.3096, -36.89013)",6.8537397,39.09556,22.146751,1519.0
"(147.15, -36.95)",9.408354,40.790546,23.0895,1292.0
"(146.45, -37.13)",9.628083,40.316017,22.47225,1353.0
"(147.15, -36.98)",9.408354,40.790546,23.0895,1292.0
"(147.32, -36.82)",9.479864,41.633244,23.43775,1303.0
"(147.15, -36.98)",9.408354,40.790546,23.0895,1292.0
"(147.15, -36.95)",9.408354,40.790546,23.0895,1292.0
"(147.149, -36.988)",9.408354,40.790546,23.0895,1292.0
"(147.13, -36.98)",9.408354,40.790546,23.0895,1292.0
"(147.15, -36.98)",9.408354,40.790546,23.0895,1292.0
"(147.149, -36.988)",9.408354,40.790546,23.0895,1292.0
"(148.381497, -35.962949)",8.269542,41.030262,23.858,1440.0
"(147.26793, -36.79985)",9.479864,41.633244,23.43775,1303.0
"(147.22086, -36.95646)",6.8537397,39.09556,22.146751,1519.0
"(147.15294, -36.95708)",9.408354,40.790546,23.0895,1292.0
"(147.22086, -36.95646)",6.8537397,39.09556,22.146751,1519.0
"(147.21743, -36.93573)",6.8537397,39.09556,22.146751,1519.0
"(147.14072, -36.98597)",9.408354,40.790546,23.0895,1292.0
"(147.21794, -36.89708)",6.8537397,39.09556,22.146751,1519.0
"(147.21743, -36.93573)",6.8537397,39.09556,22.146751,1519.0
"(147.15961, -36.99013)",9.408354,40.790546,23.0895,1292.0
"(147.16132, -36.95475)",9.408354,40.790546,23.0895,1292.0
"(147.22086, -36.95646)",6.8537397,39.09556,22.146751,1519.0
"(147.22086, -36.95646)",6.8537397,39.09556,22.146751,1519.0
"(147.24307, -36.87528)",6.8537397,39.09556,22.146751,1519.0
"(147.22086, -36.95646)",6.8537397,39.09556,22.146751,1519.0
"(148.352784, -36.405096)",6.881583,42.268078,23.133,1544.0
"(148.389015, -36.364881)",6.881583,42.268078,23.133,1544.0
"(148.267601, -36.438348)",7.8357186,41.597527,23.50275,1500.0
"(148.410977, -36.346595)",6.881583,42.268078,23.133,1544.0
"(148.352784, -36.405096)",6.881583,42.268078,23.133,1544.0
"(148.352784, -36.405096)",6.881583,42.268078,23.133,1544.0
"(148.353946, -36.40392)",6.881583,42.268078,23.133,1544.0
"(148.275115, -36.420239)",7.8357186,41.597527,23.50275,1500.0
"(148.326705, -36.436805)",7.8357186,41.597527,23.50275,1500.0
"(148.253145, -36.510618)",8.001604,41.846535,22.85225,1368.0
"(148.26337, -36.521327)",8.001604,41.846535,22.85225,1368.0
"(148.253203, -36.514223)",8.001604,41.846535,22.85225,1368.0
"(148.312371, -36.446879)",7.8357186,41.597527,23.50275,1500.0
"(148.250869, -36.438525)",7.8357186,41.597527,23.50275,1500.0
"(148.320822, -36.418841)",7.8357186,41.597527,23.50275,1500.0
"(148.269729, -36.432016)",7.8357186,41.597527,23.50275,1500.0
"(148.387735, -36.292779)",6.1706977,41.119827,23.4645,1692.0
"(148.40889, -36.006805)",6.928167,41.78015,23.69975,1647.0
"(148.40889, -36.006805)",6.928167,41.78015,23.69975,1647.0
"(147.15, -36.98)",9.408354,40.790546,23.0895,1292.0

dev/.documenter/tutorials/gbif_wflow.md

## Extract bioclim variables at occurrence points {#Extract-bioclim-variables-at-occurrence-points}

<div v-html="`&lt;div&gt;&lt;div style = &quot;float: left;&quot;&gt;&lt;span&gt;5×5 DataFrame&lt;/span&gt;&lt;/div&gt;&lt;div style = &quot;clear: both;&quot;&gt;&lt;/div&gt;&lt;/div&gt;&lt;div class = &quot;data-frame&quot; style = &quot;overflow-x: scroll;&quot;&gt;&lt;table class = &quot;data-frame&quot; style = &quot;margin-bottom: 6px;&quot;&gt;&lt;thead&gt;&lt;tr class = &quot;header&quot;&gt;&lt;th class = &quot;rowNumber&quot; style = &quot;font-weight: bold; text-align: right;&quot;&gt;Row&lt;/th&gt;&lt;th style = &quot;text-align: left;&quot;&gt;geometry&lt;/th&gt;&lt;th style = &quot;text-align: left;&quot;&gt;bio1&lt;/th&gt;&lt;th style = &quot;text-align: left;&quot;&gt;bio3&lt;/th&gt;&lt;th style = &quot;text-align: left;&quot;&gt;bio7&lt;/th&gt;&lt;th style = &quot;text-align: left;&quot;&gt;bio12&lt;/th&gt;&lt;/tr&gt;&lt;tr class = &quot;subheader headerLastRow&quot;&gt;&lt;th class = &quot;rowNumber&quot; style = &quot;font-weight: bold; text-align: right;&quot;&gt;&lt;/th&gt;&lt;th title = &quot;Tuple{Float64, Float64}&quot; style = &quot;text-align: left;&quot;&gt;Tuple…&lt;/th&gt;&lt;th title = &quot;Float32&quot; style = &quot;text-align: left;&quot;&gt;Float32&lt;/th&gt;&lt;th title = &quot;Float32&quot; style = &quot;text-align: left;&quot;&gt;Float32&lt;/th&gt;&lt;th title = &quot;Float32&quot; style = &quot;text-align: left;&quot;&gt;Float32&lt;/th&gt;&lt;th title = &quot;Float32&quot; style = &quot;text-align: left;&quot;&gt;Float32&lt;/th&gt;&lt;/tr&gt;&lt;/thead&gt;&lt;tbody&gt;&lt;tr&gt;&lt;td class = &quot;rowNumber&quot; style = &quot;font-weight: bold; text-align: right;&quot;&gt;1&lt;/td&gt;&lt;td style = &quot;text-align: left;&quot;&gt;(148.391, -36.3036)&lt;/td&gt;&lt;td style = &quot;text-align: right;&quot;&gt;6.1707&lt;/td&gt;&lt;td style = &quot;text-align: right;&quot;&gt;41.1198&lt;/td&gt;&lt;td style = &quot;text-align: right;&quot;&gt;23.4645&lt;/td&gt;&lt;td style = &quot;text-align: right;&quot;&gt;1692.0&lt;/td&gt;&lt;/tr&gt;&lt;tr&gt;&lt;td class = &quot;rowNumber&quot; style = &quot;font-weight: bold; text-align: right;&quot;&gt;2&lt;/td&gt;&lt;td style = &quot;text-align: left;&quot;&gt;(148.396, -36.3818)&lt;/td&gt;&lt;td style = &quot;text-align: right;&quot;&gt;6.88158&lt;/td&gt;&lt;td style = &quot;text-align: right;&quot;&gt;42.2681&lt;/td&gt;&lt;td style = &quot;text-align: right;&quot;&gt;23.133&lt;/td&gt;&lt;td style = &quot;text-align: right;&quot;&gt;1544.0&lt;/td&gt;&lt;/tr&gt;&lt;tr&gt;&lt;td class = &quot;rowNumber&quot; style = &quot;font-weight: bold; text-align: right;&quot;&gt;3&lt;/td&gt;&lt;td style = &quot;text-align: left;&quot;&gt;(147.096, -36.9357)&lt;/td&gt;&lt;td style = &quot;text-align: right;&quot;&gt;9.40835&lt;/td&gt;&lt;td style = &quot;text-align: right;&quot;&gt;40.7905&lt;/td&gt;&lt;td style = &quot;text-align: right;&quot;&gt;23.0895&lt;/td&gt;&lt;td style = &quot;text-align: right;&quot;&gt;1292.0&lt;/td&gt;&lt;/tr&gt;&lt;tr&gt;&lt;td class = &quot;rowNumber&quot; style = &quot;font-weight: bold; text-align: right;&quot;&gt;4&lt;/td&gt;&lt;td style = &quot;text-align: left;&quot;&gt;(148.333, -36.4333)&lt;/td&gt;&lt;td style = &quot;text-align: right;&quot;&gt;7.83572&lt;/td&gt;&lt;td style = &quot;text-align: right;&quot;&gt;41.5975&lt;/td&gt;&lt;td style = &quot;text-align: right;&quot;&gt;23.5028&lt;/td&gt;&lt;td style = &quot;text-align: right;&quot;&gt;1500.0&lt;/td&gt;&lt;/tr&gt;&lt;tr&gt;&lt;td class = &quot;rowNumber&quot; style = &quot;font-weight: bold; text-align: right;&quot;&gt;5&lt;/td&gt;&lt;td style = &quot;text-align: left;&quot;&gt;(148.236, -36.5249)&lt;/td&gt;&lt;td style = &quot;text-align: right;&quot;&gt;8.0016&lt;/td&gt;&lt;td style = &quot;text-align: right;&quot;&gt;41.8465&lt;/td&gt;&lt;td style = &quot;text-align: right;&quot;&gt;22.8522&lt;/td&gt;&lt;td style = &quot;text-align: right;&quot;&gt;1368.0&lt;/td&gt;&lt;/tr&gt;&lt;/tbody&gt;&lt;/table&gt;&lt;/div&gt;`"></div>